author,date,description,source,text,title,url
Storyful,2022-08-24T11:56:14.000Z,"Ukrainian President Volodymyr Zelensky and his wife, Olena Zelenska, visited a Kyiv memorial for Ukrainians killed during the war with Russia to mark the...",Yahoo News,"Ukrainian President Volodymyr Zelensky and his wife, Olena Zelenska, visited a Kyiv memorial for Ukrainians killed during the war with Russia to mark the country’s Independence Day.,The Wall of Remembrance of the Fallen Defenders of Ukraine at St Michael’s Cathedral in Kyiv commemorates Ukrainians who have died in battle, including since the 2014 outbreak of war in the eastern Donbas region.,“We remember the terrible price of freedom and independence that our people paid,” Zelensky said in an Instagram ,. “Respect and gratitude to all those who died for our native land and our free future.”,Kyiv has banned mass gatherings as a security measure as Ukraine marks its Independence Day on August 24, along with six months since the Russian invasion. Credit: Volodymyr Zelensky via Storyful,[MUSIC PLAYING]",Zelensky Visits Kyiv Memorial for War Victims,https://news.yahoo.com/zelensky-visits-kyiv-memorial-war-115614635.html
Reuters Videos,2022-08-24T10:53:00.000Z,STORY: Ukraine's Independence Day falls exactly six months after the start of Russia's invasion in February. Russia sent its troops over the border in what...,Yahoo News,"STORY: Ukraine's Independence Day falls exactly six months after the start of Russia's invasion in February. Russia sent its troops over the border in what it calls a ""special military operation"" saying it wanted to demilitarize its neighbor and protect Russian-speaking communities. Ukraine and its Western allies accuse Moscow of waging an unjustified, imperial-style war of aggression.,The prayer service took place at Saint Sophia Cathedral in Kyiv.,The Kyiv city administration banned large public gatherings until Thursday, fearing that a crowd of celebrating residents could become a target for a Russian missile strike.",Zelenskiy attends Independence Day church prayer,https://news.yahoo.com/zelenskiy-attends-independence-day-church-105300714.html
Joe Barnes,2022-08-25T12:45:26.000Z,"Russian forces have lost an area of captured territory larger than Denmark as they struggle to turn territorial gains into operation successes, according to ...",Yahoo News,"Russian forces have lost an area of captured territory larger than Denmark as they struggle to turn territorial gains into operation successes, according to military analysts.,The Kremlin's invasion , in recent months, after its troops were forced back from Kyiv in the early weeks of the war.,Vladimir Putin’s troops have only managed to seize an area the size of Andorra – an estimated one per cent of what they have lost – in the last 39 days, the latest assessment by the Institute for the Study of War (ISW), a US-based think-tank, suggests.,It came as Sergei Shoigu, the Russian defence minister, told a conference that Russian forces had deliberately slowed down their offensive operations in Ukraine to reduce the number of civilian casualties.,Despite the apparent slow-down, Mr Shoigu insisted Russia's invasion was going according to plan and his forces would achieve their maximalist objectives.,Russia's ministry of defence has previously stated it still intends to topple the Ukrainian government despite its withdrawal from Kyiv to focus on the eastern Donbas region.,The ISW said Mr Shoigu had made his statement in an attempt to explain away the failings of Russian forces in Ukraine.,""Shoigu's statement may also represent an attempt by the Russian MoD to set information conditions to explain and excuse the negligible gains Russian forces have made in Ukraine in the last six weeks,"" the think-tank said.,""Russian forces are unable to translate limited tactical gains into wider operational successes, and their offensive operations in eastern Ukraine are culminating. Shoigu’s statement is likely an attempt to explain away these failings."",According to the ISW's latest assessment, Moscow has captured roughly 174 square miles of new territory since announcing an operational pause on July 16.,Russian forces, however, have managed to lose 17,375 square miles since March 21, the estimated date of Russia's deepest advance into Ukraine.,With Western weapons, Ukrainian soldiers pushed the Russians out of Kyiv and forced them to retreat to Donbas, the country's industrial heartlands.,Now with long-range rocket launchers, supplied by the US and UK, Ukraine's armed forces have managed to stall Russian advances by targeting strategically important logistical targets key to Moscow's war efforts.,Oleksiy Reznikov, Ukraine's defence minister, has said he expects ""good news from the frontlines"" before the end of the year.,""We have a chance to win sooner and cheaper in terms of Ukrainian losses, thanks to the alliance with our partners,"" he said in an interview with Ukrainian military TV.",Ukraine recaptures territory larger than Denmark from Russian invaders,https://news.yahoo.com/ukraine-recaptures-territory-equal-size-124526414.html
Caroline Thayer,2022-08-24T14:12:13.000Z,"Demi Lovato discusses trying opiates at 13, loving cocaine ""too much,"" and how she abused drugs and alcohol to get away from her former management team while...",Yahoo News," got heartbreakingly personal in a new podcast.,The singer revealed she started abusing opiates at the age of 13.,In a new episode of , promoting her latest album, ""Holy Fvck,"" Lovato revealed she had been in an accident and in the aftermath, was prescribed medication.,She recalls, ""I started experimenting for the first time when I was 12. I'd got — or 13 — I'd got into a car accident, and they had prescribed me opiates. And my mom didn't think she'd have to like lock up the opiates from her 13-year-old daughter."",She says at the time of the accident, ""I was already drinking at that point, I was, you know, had already been bullied — was looking for an escape, and when my mom saw how many of the pills had disappeared and how fast they did, she took ‘em away and locked ‘em up."",Lovato also noted that the first time she consumed alcohol was alone, and how that ""should have been a major red flag."",The ""Complicated"" singer, who has , for various struggles, exposed the harrowing reality and pressures of being a child actor.,Growing up exposed to mental illness, Lovato has openly discussed her father's reported Schizophrenia and mother's reported eating disorder, the singer and actress struggled from a young age.,Growing up, Lovato also recalled having a strange interest in death. She shared, ""As a 7-year-old when my depression started to kick in, it was more of like this fascination of death … I entered therapy and guidance counseling at the school at 7 years old."",Lovato revealed her previous team was extremely restricting with access to food, which only amplified the singer's known eating disorder.  In 2018, she ,.,In the podcast, she alluded to previous management, predominately led by one person, being the reason for ditching her sobriety. She said, ""My way of like blowing everything up was relapsing on drugs and alcohol, 'cause they always said, ‘If you use, we’re out.' And I was like, ‘All right, time to get out. Bye.’"",Lovato is currently managed by Scooter Braun. Her previous manager was Phil McIntyre.",Demi Lovato says she tried opiates at 13 and was in therapy for depression at 7,https://news.yahoo.com/demi-lovato-says-she-tried-141213949.html
Amber Raiken,2022-08-24T19:08:31.000Z,"‘I had been bullied and was looking for an escape,’ the singer says",Yahoo News," has spoken out about her past experiences with , and revealed that she was 13 years old the first time she used opiates.,During Wednesday’s episode of the ,, the 30-year-old singer recalled how she first tried drugs as a teenger, noting how she had already “started drinking” at the time.,“I started experimenting for the first time when I was 12, or 13. I got into a car accident and they prescribed me opiates,” she told host Alexandra Cooper. “My mom didn’t think she would have to lock up the opiates from her 13-year-old daughter but I was already drinking at that point.”,“I had been bullied and was looking for an escape,” she added.,The “Cool for the Summer” singer said that when her mother realised “how many of the pills had disappeared”, she decided to “lock them up”.,As she explained how she “drank a lot” as a teen, Lovato noted that throughout the ages of 15 and 16, when her mother had a Xanax addiction, she stole some of her mother’s pills.,Although her experiences with drugs were “off and on” throughout those years, Lovato confessed that she decided to experiment with cocaine at the age of 17.,“It was the first time I tried coke and, like, loved it too much and then kinda bled into me going to treatment right after I turned 18,” the former Disney star added.,Lovato then discussed some of her previous drinking habits and her first time drinking, which was when she “stole beer” from her stepfather’s refrigerator.,“My first time drinking, I was alone, and that should have been a major red flag,” she explained. “I stole beer from my dad, in the fridge, my step dad and took it to my room and drank like four beers just to see what it was like to feel drunk.”,“I was like a little 90-pound girl,” she recalled. “So that was a lot. Then it started being with like friends and it wasn’t ever alone after that.”,This isn’t Lovato’s first time opening out about her experiences with substance abuse.,, she spoke about being “California sober”, an approach that involves consuming marijuana and alcohol in moderation. The decision came after her near-fatal overdose in July 2018. However,,, the actor said that she no longer supported her “California ways” and that ââ”sober sober is the only way to be”.,In a YouTube documentary,,released in April 2021, the “Confident” singer detailed her journey through relapse, hospitalisation, and recovery after her overdose.",Demi Lovato reveals she used opiates for first time at 13,https://news.yahoo.com/demi-lovato-reveals-she-used-184859428.html
"Dezimey Kum, USA TODAY",2022-08-25T22:40:36.000Z,A tweet that purports to show Donald Trump Jr. discouraging Trump supporters from visiting the Mar-a-Lago estate is satire.,Yahoo News,"After supporters of former President Donald Trump,, a tweet circulated online purporting to show Donald Trump Jr. telling supporters to stay away from the location.,“While my Father loves almost all his supporters, please do not come to Mar-a-Lago to support President Trump,” reads , showing a screenshot of the ,.  “We have many important people coming through the club and need to keep it clean.”,The Facebook post adds,  ""Yeah, lots of important spies and other violent felons will be dropping by quite a bit from now on,"" reads the caption.,The post accumulated over 2,000 interactions and 100 shares within three days. Similar posts have amassed hundreds of interactions on , and ,.,Comments showed many users took the post seriously, like one that read, “So he admits that his supporters are NOT important or clean people!!”,But the supposed tweet isn't real.,The tweet was created as satire, as noted by text in the bottom right of the supposed screenshot. USA TODAY found no evidence the tweet in the post was by Donald Trump Jr.,USA TODAY reached out to the online users who shared the claim for comment.,The fake tweet originated from account ,, the profile for which says, “Trying to understand this crazy world & get a few laughs. Most of our images are satire.”,The bottom right corner of the tweet says “Parody by Back Rub"" which clearly indicates the fabricated image was made as a joke. The time stamp on the fabrication is another clue, as it reads “6:99 AM."",The account provided clarification ,for those who did not spot the parody label: ""This is a parody, which we posted at 6:99 AM as it says on the bottom :),"" reads the tweet.,There are no credible news reports suggesting that Donald Trump Jr. told his father's supporters not to visit Mar-a-Lago. The tweet is not mentioned on any of Donald Trump Jr.'s verified, , ,. Referencing a fact check of the claim by ,, Trump Jr. , Aug. 16 saying the claim was ""clearly something I would never say."",Based on our research, we rate SATIRE an image that purports to show a tweet from Donald Trump Jr. urging Trump supporters to stay away from Mar-a-Lago. The claim stems from a Twitter account that is known for creating satirical content, and it was clearly labeled as such.",Fact check: Satirical tweet on Mar-a-Lago visitors circulates online,https://news.yahoo.com/fact-check-satirical-tweet-mar-224036578.html
Samantha Olson,2022-08-24T15:18:00.000Z,"In a game of Song Association with ELLE, Demi Lovato teased a possible rock version of her 2015 song, ""Cool for the Summer."" Here's what went down.",Yahoo News,"#Rockvato is officially back. Since the release of her latest album, ,, , has been vocal about swapping her radio-friendly sound for a genre that feels more authentic to her: pop punk. At the beginning of this year, Demi even jokingly posted a pic with her team wearing all black with the caption ""A funeral for my pop music."",Her eighth studio album takes a more mature approach to the emo-inspired sound she explored on the first two records she released as a teen — , and , — but that doesn't mean she's unaware of the impact her pop hits have had over the years. During the latest installment of ,'s Song Association, Demi belted songs by Paramore, Avril Lavigne, The All-American Rejects, and, of course, herself. One of the tracks she sang was her bisexual anthem, ""Cool for the Summer,"" which still feels authentic to her. The 2015 single has recently made , and she ended up officially releasing a , on streaming platforms. The track has also received praise from celebs like ,.,Demi even teased that a rock version of the song could potentially be in the works. ""If I had to re-record one of my songs for this album, it'd be 'Cool for the Summer,'"" Demi told ,. ""Just 'cause I feel like it matches the tone of this album. It's got that guitar on it that would be perfect for this album, and you never know what I might do in the future."",Check out Demi's full episode of ,'s Song Association below to see her give major grown-up ,energy.","Demi Lovato Teases Rock Re-Recording of ""Cool for the Summer""",https://news.yahoo.com/demi-lovato-teases-rock-recording-151800779.html
Reuters,2022-08-25T10:47:26.000Z,"There are no U.S. approved vaccines for RSV, a common virus that typically causes mild cold-like symptoms but can be fatal for young kids and older adults.  ...",Yahoo News,"(Reuters) - Pfizer Inc said on Thursday its vaccine for Respiratory Syncytial Virus (RSV) was effective among older adults in a late-stage study and it plans to file for approval with the U.S. health regulator in the coming months.,There are no U.S. approved vaccines for RSV, a common virus that typically causes mild cold-like symptoms but can be fatal for young kids and older adults. RSV is estimated to cause about 14,000 annual deaths among older adults in the United States.,Pfizer's vaccine was 85.7% effective among participants with three or more symptoms, and 66.7% for two or more symptoms, according to an interim analysis carried out by an external data monitoring panel.,The vaccine, RSVpreF, was also found to be well-tolerated with no safety concerns in the study.,Pfizer's shot is designed to target two strains of the respiratory virus. The company has so far enrolled about 37,000 participants aged 60 and above in its late-stage global study of the vaccine.,Rival Moderna also began a late-stage study of its messenger RNA shot for RSV in February.,Pfizer said it also plans to prepare submissions for approval of the shot to other regulatory authorities in the coming months.,(Reporting by Amruta Khandekar; Editing by Shinjini Ganguli)","Pfizer's RSV vaccine found effective, safe among older adults in study",https://news.yahoo.com/pfizers-rsv-vaccine-found-effective-104726030.html
BuzzFeed,2022-08-24T20:09:37.000Z,"""The way that he has talked about women is unconscionable to me.""View Entire Post ›",Yahoo News,,"Chelsea Clinton Said She Removed Kanye West's Music From Her Library Because Of ""The Way That He Has Treated Kim Kardashian""",https://news.yahoo.com/chelsea-clinton-said-she-removed-200937199.html
Sara Delgado,2022-08-25T19:00:00.000Z,“Have you ever sat down and discussed the challenges of being inside this Disney machine?”,Yahoo News,"If you were an OG Disney Channel fan, one of Demi Lovato’s next projects might just pique your interest. ,On August 24, Lovato , and revealed she has a project in the works that she'd like to involve a bunch of stars from her Disney Channel heyday. She envisions former child stars—think Miley Cyrus, Selena Gomez, the Jonas Brothers, etc.—sitting down to reflect on how growing up in the spotlight has impacted their lives and careers.,When asked by host Alex Cooper whether the singer still kept in contact with any fellow Disney Channel alums or discussed the challenges of existing within the “Disney machine,” Lovato said, “I think over the years we've talked about it for sure, but I do have a project in the works where I want to talk to some of those people about their experiences.” , did not elaborate much on specific details for the project, which could mean it is still in early development, but she did share she wanted it to feature “other child stars as well.”,The still-unnamed project is not the first time Lovato has reminisced about the Disney Channel days. , on August 17, the artist also took the chance to briefly walk down memory lane and share advice for young stars today. “It's more important to have a personal life than it is a career at that age,” Lovato told the publication. “I think that's what got lost in the era of Disney when I was in it. We were all working so hard, running ourselves into the ground.”,Lovato also shared that she feels like she “didn't have a lot of fun in my downtime” while she was a , and was “often thinking about what I needed to do next,” and added that she definitely felt pressure to “look a certain way,” “be a certain way,” and “act a certain way.”,The singer elaborated on the point, saying that she feels young stars don't get to “experience childhood” or “life as a teenager” while constantly “under a microscope.”,“If you want to be a teenager, be a teenager,” advised Lovato. “If you want to do this for a living, maybe wait a little bit until you're older so you can have life experience under your belt.” The best piece of advice, however, is to just take it easy. ,“You don't have to be on top of the world,” Lovato said. “Enjoy your time right now. Be present.” Check out the full , episode with Demi Lovato below., ,Originally Appeared on ",Demi Lovato Wants to Speak to Former Disney Channel and Child Stars for a New Project,https://news.yahoo.com/demi-lovato-wants-speak-former-190000379.html
WABC – NY,2022-08-25T02:15:01.000Z,Nearly a dozen beagles will soon be up for adoption at the SPCA Westchester Animal Rescue Center in New York.,Yahoo News,Nearly a dozen beagles will soon be up for adoption at the SPCA Westchester Animal Rescue Center in New York.,Rescued beagles to be put up for adoption in NY soon,https://news.yahoo.com/rescued-beagles-put-adoption-ny-021501109.html
"Amanda Luberto, Arizona Republic",2022-08-24T13:00:23.000Z,Gov. Doug Ducey achieved a longstanding goal by expanding school choice. The Gaggle examines how it may or may not benefit Arizona families.,Yahoo News,"As his two terms as governor wind down, Doug Ducey crossed off one of the goals he's had on his list for nearly eight years.,He signed into law House Bill 2853, expanding school vouchers to allow all parents to use them for private school tuition or other educational costs. It's being lauded as the biggest school-choice victory in the nation.,Supporters say it will increase opportunities for Arizona students and families to choose the education they want without being limited by financial situations, but critics argue it casts a blind eye to the already struggling public school system in the state.,This week on The Gaggle, a podcast by The Arizona Republic and azcentral.com, host , is joined by K-12 education reporter,to break down what the law really means for the future of the state and what it means for Ducey's legacy as governor.,Later in the show, , vice president and director of RAND Education and Labor, discusses potential obstacles Arizona parents could still face and where the expanded voucher program places the state in the national conversation.,.,Follow The Gaggle and all azcentral.com podcasts ,.,We’re looking to hear from you! Have this year’s primaries left you with questions about Arizona’s political landscape? We want to know. Send us a note or a voice memo ,Available on ,, , and ,. Turn on notifications to be alerted when a new episode is released.",School vouchers have been expanded. The Gaggle finds out just what that means for Arizona,https://news.yahoo.com/school-vouchers-expanded-gaggle-finds-130023292.html
Jamie Spanfeller,2022-08-25T17:22:00.000Z,"Jenna Dewan posted a video of herself pole dancing on Instagram in a cut-out bodysuit and fishnets, revealing her toned abs and legs. Jenna loves doing...",Yahoo News," just proved that she's a master at basically all dance forms while dominating a pole dancing routine set to , Everyone's, well, freaking out, after watching the new Instagram video she posted.,In the video, Jenna got busy flaunting her sculpted abs and strong legs while also showing off her epic dance skills. She even incorporated spins, squats, and body rolls, along with some very strategic hair flipping into her choreography. Of course, the mirrors behind her provided a little glimpse of her perky, toned booty.,NGL, the flashing, colorful lights just ,.,""Let’s Get Physical coming sooooon 💪🏽 🎥 😈,"" the 42-year-old dancer and actress captioned the post. Jenna's new movie, ,, premieres on October 15, and this dancing video is more than enough incentive to tune in.,Fans echoed her excitement. ""Omgggg you did that😍😍😍😍😍😍 legend,"" one fan commented. ""Sheeeeshhh 🔥🔥,"" another wrote. Kelly Ripa even chimed in with ""YAAAAAAZZZZZZZZZZ👏👏👏👏👏🔥🔥🔥🔥🔥🔥🔥."" All in all, this post was basically a breeding ground for fire emojis., Jenna dancing again:, requires killer strength, so it's not surprising that Jenna is all-over sculpted. The exercise requires total-body muscle engagement, according to ,'s pole dancing coach, Johanna Sapakie. ""Everything is working in unison to create the movement,” she previously told ,This also means that strong abs are a definite must. ""Your core will help support the rest of your body, so your arms will simply have to do less work,"" Sapakie said. No wonder Jenna is ,.,When Jenna steps away from the pole, she turns to , to tone her muscles. She'll do three or four classes a week with one of her fave instructors ,, Jenna told ,.,""You feel things just all start to go where they’re meant to go,"" Jenna said about her Pilates sessions. “It gets you fit so fast, and you just feel stronger.”,Jenna also enjoys Isaac Boots’ Instagram Live workouts, which combine cardio and strength for high-energy classes. Clearly, ,!,When it comes to Jenna's diet, she loves her greens. She sticks to a mainly , and starts every morning with a , made from spinach, romaine, celery, cilantro, parsley, apple, banana, and lemon, she told ,. Yum!,Keep dancing, Jenna!",Jenna Dewan Is Showing Off How Sculpted She Is While Pole Dancing On IG,https://news.yahoo.com/jenna-dewan-showing-off-sculpted-172200764.html
