author,date,description,source,text,title,url
Marquise Francis,2022-08-25T15:57:58.000Z,Oklahoma is set to execute its first of more than two dozen death row inmates over the next 29 months. But given the state’s complicated history with...,Yahoo News,"Beginning Thursday, Oklahoma is set to execute its first of more than two dozen death row inmates over the next 29 months — an average of one execution per month over the next two years. If carried out in full, the unprecedented number of 25 executions would put to death ,, who include a flurry of incarcerated individuals with mental health disorders and others who have maintained their innocence.,Given the state’s , with executions, which includes , and a , of death row inmates, legal experts and critics alike are perplexed by its fervor to kill so many people in such a short amount of time.,“Why the rush to execute 25 people?” Tracy Hresko Pearl, a professor at the University of Oklahoma College of Law, queried in an interview with Yahoo News, calling 25 executions in two years “horrifying.”,James Coddington was the first inmate to be executed and died on Thursday morning. Coddington, who had been in jail since 1997 for killing a friend who refused to loan him $50 to buy cocaine, was , by Republican Gov. Kevin Stitt on Wednesday, despite the Oklahoma Pardon and Parole Board recommending him for clemency earlier this month. Coddington repeatedly expressed remorse for the murder, and his lawyers said he had worked to turn his life around for the better behind bars — all to no avail.,“Oklahoma views its criminal justice system as, No. 1, infallible and, No. 2, punitive, above all else,” Pearl said. “I think that the advent of DNA evidence has really shown us how often we get cases, and even very serious capital cases, wrong.”,In fact, according to the , by the National Registry of Exonerations, somewhere between 2% and 10% of all convicted individuals in U.S. prisons are innocent — a stat that many legal experts argue is far too high to legitimize capital punishment for anyone. , by the registry in 2020 found that more than half of the wrongful criminal convictions are caused by government misconduct, which rarely faces consequences.,“Misconduct by police, prosecutors and other law enforcement officials is a regular problem and it produces a steady stream of ,, an emeritus professor at the University of Michigan Law School and a co-founder of the registry, told the Washington Post.,It’s an ugly truth that many have paid for with their life, while others have paid financially.,State capital cases, or death penalty proceedings, cost state taxpayers 3.2 times more than non-capital cases on average, according to a ,. More revealing, an analysis of 15 death penalty cases nationwide, from that same study, determined that seeking the death penalty results in an average of approximately $700,000 more in costs than not seeking death.,Complicating the death penalty’s implementation, certified physicians are barred from participating in the practice. The , in 2006 announced that any physician who participates in an execution violates their Hippocratic oath to protect lives. As a result, the state goes to extreme lengths to administer executions. Earlier this year it was revealed that Oklahoma paid a doctor , (to check consciousness, verify the drugs being used and ultimately confirm death), plus another $1,000 a day for training. The high financial burden, coupled with various moral and efficacy dilemmas associated with state-sanctioned executions, presents a serious cause for concern for many critics.,“My hope is always that the state views the goal of its criminal justice system to be truth above all else,” Pearl said. “And I think that when a state rushes to execute a large number of people, what it’s doing is something very different than pursuing truth. It’s pursuing punishment above all else. And I think that should be incredibly disturbing for all Americans.”,Another concern for legal experts is transparency around where the ingredients that make up lethal injections for Oklahoma executions come from, something they say has always been shrouded in secrecy. Readily available information online details a three-drug method, which is the ,: a barbiturate that acts as a sedative and painkiller, a drug that causes paralysis such as vecuronium bromide and a dose of potassium chloride to stop the heart.,No information about where the drugs are obtained or their efficacy is publicly available. The Oklahoma Department of Corrections, which is in charge of carrying out the executions, did not respond to multiple requests for comment from Yahoo News.,Andrea Digilio Miller, legal director of the Oklahoma Innocence Project, an organization dedicated to finding and resolving wrongful conviction cases in the state based at the Oklahoma City University School of Law, believes more transparency in the entire execution process would allow Americans to have more informed views on the death penalty. In its absence, she says, many are left to think the worst.,“Who are we getting our [lethal injection] drugs from?” Miller probed in an interview with Yahoo News. “If these aren’t drugs that are really available on the open market, where are they coming from? And are they expired? I think those are the sorts of things that people should know so that it can inform their individual beliefs about the death penalty.”,Having spent more than two decades as a public defender in Oklahoma, Miller has at least six former clients who are on the list of 25 death row inmates slated to be executed in the next two years. Among those names was Coddington.,For Miller, given Oklahoma’s deeply conservative values, which are anti-abortion and include having the , in the country, the championing of the death penalty seems to go directly against the basic idea of preservation of life.,“We in this country talk so much about trying to protect children while they’re children, but then for the children who slipped in the cracks and the system doesn’t help, we’re more than willing to throw them away on the back end when they make a mistake,” she said. “And that’s very much what the James Coddington story is.”,“He came from abject poverty. He came from a very abusive background and a background where everybody in his life had substance abuse problems,” she added. “And every death row inmate I have ever represented suffered from the consequences of that type of trauma.”,In spite of advocates’ best efforts to delegitimize the death penalty in Oklahoma, the reality is that executions have been the law of the land in the state for more than two centuries. Capital punishment was , there in 1804 when Congress made criminal laws in the U.S. applicable to lands acquired in the Louisiana Purchase, which include present-day Oklahoma. At the time, only “willful murder” was punishable by the death penalty. Since then, Congress has expanded the scope to include several other offenses, including treason, espionage and rape.,The original death penalty law called for executions to be carried out by electric chair, but the Supreme Court deemed that ,. The current ,, enacted in 1977, calls for executions to be carried out by lethal injection. From 1915 to 2022, Oklahoma has executed a total of 196 men and three women, according to the ,.,But they haven’t all gone as planned.,In 2014, Oklahoma death row inmate Clayton Lockett , for more than 40 minutes during his execution before suffering a heart attack. Just months later, another inmate, Charles Warner, complained, “,,” according to witnesses, as he was killed. Then just last year, inmate John Grant, , as he lay on the gurney before he died, drawing sharp criticism for the practice.,Richard Glossip, one of the 25 death row inmates scheduled to be executed, will likely eat his , on death row. In 2015, just as he was set to be injected with the lethal cocktail, officials realized they had the wrong drug, sparing his life. Having always , for a killing he was accused of, Glossip is hoping a last-minute appeal works in his favor.,Instead of Oklahoma leadership slowing down executions as numerous issues arise, the process and quantity are just picking up.,“Oklahoma did not execute anyone for over 6 years and 9 months, from mid-January of 2015 until late October of 2021,” Maria T. Kolar, an assistant professor of law at Oklahoma City University School of Law who teaches courses about criminal law and capital punishment, told Yahoo News in an email. “In an era when executions are at a new low nationwide for the modern era — for so many reasons — it seems reasonable to ask whether Oklahoma really wants to ‘lead the nation’ when it comes to executions.”","Oklahoma readies for 25 executions in 2 years. But critics ask, 'Why the rush?'",https://news.yahoo.com/oklahoma-executions-james-coddington-death-row-inmates-155758358.html
Beatrice Nolan,2022-08-25T11:07:07.000Z,"Data shows that Marjorie Taylor Greene's company, Taylor Commercial, Inc., had $183,504 in Paycheck Protection Program loans forgiven.",Yahoo News,"Rep. Marjorie Taylor Greene criticized Biden's student-loan-forgiveness plans as ""completely unfair,"" despite records showing that her own company had $183,504 worth of Paycheck Protection Program loans forgiven in 2020.,On Wednesday, the Biden administration announced plans to , for most borrowers, fulfilling a campaign promise and extending relief to millions of borrowers. US residents earning , are eligible for loan forgiveness.,In her interview on ,, Taylor Greene said the plan was unfair to taxpayers who had never taken out a student loan.,The Georgia Republican added that she opposed the student-loan program in the first place, saying: ""There should not be a system in place that allows them and encourages them to pile up massive debt in these big colleges and universities."",Data from ,, a tracking site that uses data from the Small Business Association, shows that Taylor Green was one of several Republican members of Congress who had private loans forgiven.,The data shows that the total amount forgiven was $183,504, which represented full forgiveness of the original $182,300 loan, plus the accrued interest. The majority of the relief issued in April 2020 was used for payroll, according to the data.,The Small Business Association did not immediately respond to Insider's request for comment, which was made outside normal working hours., says that she and her husband, Perry Greene, bought her family's construction business, Taylor Commercial, Inc., prior to her election.,Representatives for Taylor Commercial and Taylor Greene did not immediately respond to Insider's request for comment.,Taylor Greene also criticized the Biden administration as having a purely political agenda for the student-loan plan, telling Newsmax TV that he was looking ""to bring in blue votes in November."",Read the original article on ","Marjorie Taylor Greene says student-loan forgiveness is 'completely unfair' despite the fact her company had loans worth $183,504 forgiven",https://news.yahoo.com/marjorie-taylor-greene-says-student-110707728.html
Tyler Greenawalt,2022-08-24T14:39:07.000Z,Leonsis would own four of the five major DC sports teams if he bought the Nationals.,Yahoo News,"Ted Leonsis, the owner of the Washington Wizards, Washington Mystics and Washington Capitals is looking to add a fourth major professional sports team to his company's portfolio: The Washington Nationals.,Leonsis' company, Monumental Sports & Entertainment, was reportedly granted access to the Nationals' financial data, according to the ,.,That's a big step in a potential bid for the MLB franchise. The Lerner family , in April, which could include an outright sale.,Zach Leonsis, the son of Ted Leonsis and Monumental’s president of media and new enterprises, said Tuesday that it was “not appropriate to comment"" when asked about the family's interest in the Nationals.,There are at least five suitors for the Nationals, per the ,, which include billionaire Michael B. Kim, the co-founder and partner of MBK Partners, a private equity firm headquartered in Seoul, South Korea, and Stanley Middleman, the CEO of Freedom Mortgage in New Jersey.,Leonsis, 65, bought his first major professional sports team in 1999 when he paid $85 million for the Capitals. He became the majority owner of the Wizards and Mystics in 2010 and combined all three teams under one ownership group at Monumental. Leonsis' company also owns the Verizon Center where the Capitals, Wizards and Mystics play, NBA G League’s Go-Go and the NBA 2K League’s Wizards District Gaming.,Monumental also announced it is buying NBC Sports Washington, the network that owns the broadcast rights for the Wizards and Capitals.,The Nationals are valued at $2 billion, per ,. It's unclear if Leonis and Monumental would buy the team outright, bring in other investors or work with the Lerners on a new ownership structure. Coincidentally, Mark Lerner, who is the Nationals’ managing principal owner, is also a minority partner in Monumental. The Post and the , that David Rubenstein, co-founder of the private equity firm, the Carlyle Group, will be joining Leonis and Monumental in a bid for the Nationals.,The Los Angeles Angels are also reportedly up for sale, owner Arte Moreno , Tuesday. That franchise is valued at $2.2 billion.,Washington is reaching a bit of an inflection point in its franchise after the organization won the World Series in 2019. The Nationals traded superstar , Juan Soto to the San Diego Padres earlier this month and look directionless as Washington flops to perhaps another last-place finish in the NL East for the third time in three years.,Whoever buys the Nationals will have their work cut out for them.","Ted Leonsis, owner of the Wizards, Capitals and Mystics, is reportedly interested in buying the Nationals",https://news.yahoo.com/ted-leonsis-owner-of-the-wizards-capitals-and-mystics-is-looking-at-buying-the-nationals-143907643.html
Ronda Lee,2022-08-24T15:43:06.000Z,"President Biden on Wednesday announced $10,000 in student loan debt forgiveness for individuals who make $125,000 or less and for households that earn...",Yahoo News,"President Joe Biden delivered a win-win for student loan borrowers.,The president on Wednesday announced the federal government will forgive $10,000 in student loan debt for individuals who make $125,000 or less and for households that earn $250,000 or less, according to a ,. An additional $10,000 in forgiveness goes to those who received need-based Pell Grants.,Biden also extended the pandemic forbearance on federal student loans to December 31, helping those who didn't make the forgiveness cut or who would still have an outstanding balance after forgiveness. The administration also laid out other steps to reduce the education cost burden for existing and future borrowers.,The latest move delivers on Biden’s campaign promise for student debt relief and could help up to 43 million borrowers, according to the administration.,An erasure of $10,000 for all borrowers with federally-backed loans would cost roughly $371 billion and eliminate loans for about a third of borrowers. While the $125,000 income cap reduces the cost and scope, 90% of the relief goes to households with $75,000 in yearly income or less, according to figures from the Department of Education.,""No individual making more than $125,000 or household making more than $250,000 – the top , of incomes in the United States – will receive relief,"" the fact sheet provided by the administration stated.,With $10,000 in forgiveness, “you're going to reach a lot more borrowers that are at significant risk of default,” Antoinette Flores, director of postsecondary education at the Center for American Progress (CAP), t,. “We know that the majority of borrowers who ended up defaulting have debt below $10,000.”,The additional $10,000 for Pell Grant recipients also further helps the more finanially vulnerable. According to the administration fact sheet, Pell Grant recipients account for more than 60% of the borrower population and nearly all come from a family that earns less than $60,000 a year.,""The potential of an extra $10,000 worth of forgiveness for some Pell Grant Recipients was unexpected, but it makes sense given that it directly targets lower income borrowers and runs contrary to the narrative that student loan forgiveness is a 'handout to the rich,' as some have argued,"" Jacob Channel, senior economist at Student Loan Hero, said in a statement.,Additionally, Biden is extending the payment pause to the end of the year. The relief originally was set to ,. The extension will provide temporary relief for the remaining borrowers who are ineligible for forgiveness or who will receive limited relief from the elimination of $10,000 in debt.,The pause is the final extension after originally enacted,at the beginning of the pandemic in March 2020 to help borrowers who were facing financial troubles such as job loss or furloughs.,It has been extended seven times collectively by both administrations, and some experts said it was necessary to extend forbearance again this time around as borrowers and servicers were not ,.,""In keeping with my campaign promise, my Administration is announcing a plan to give working and middle class families breathing room as they prepare to resume federal student loan payments in January 2023,"" the president tweeted.,The Education Department is also proposing a rule to cap monthly payments for undergraduate loans at 5% of a borrower’s discretionary income, which is half the rate borrowers pay now under most plans. That will reduce the average annual student loan payment by more than $1,000 for both existing and future borrowers, according to the administration.,The department will also propose forgiving loan balances after 10 years of payments — instead of 20 years — for borrowers who had original loan balances of $12,000 or less, which would especially help borrowers who attended community college.,Another move will be to fix the ,that provides student debt forgiveness for borrowers after working at least 10 years in public service jobs with federal, state, local, or certain non-profit organizations.,A big concern is how loan forgiveness will be processed and administered considering the $125,000 individual income cap and $250,000 household income cap on their 2020 or 2021 tax return.,The Education Department is in charge of administering the program and will have an application available to borrowers before the federal forbearance expires on December 31. Borrowers can sign up for notifications on the dedicated ,.,For the 8 million borrowers whose income data is already in the Education Department database, they may see automatic relief. For borrowers whose data isn't readily available, there may be delays to verify income.,“People who need the relief will end up not getting benefits because of paperwork delays, similar to public service loan forgiveness (,) applicants experiencing problems with denials,"" Katherine Lucas McKay, associate director of research at Aspen Institute’s Financial Security Program, told Yahoo Money. ""PSLF borrowers have to certify their income with the IRS, who then sends an automated notification to the Education Department of income based on current year tax return based on individual income."",Currently, the IRS has a, backlog of unprocessed paper returns, an eight-month backlog in processing taxpayer correspondence, and a hiring shortage., ","Student loan forgiveness: Biden cancels $10K in student loans, extends forbearance",https://news.yahoo.com/student-loan-forgiveness-biden-154306915.html
Costas Pitas,2022-08-26T02:58:06.000Z,"A U.S. plan announced this week to forgive $10,000 in student loans for millions of debt-saddled former college students will cost roughly $24 billion a year...",Yahoo News,"By Costas Pitas,(Reuters) - A U.S. plan announced this week to forgive $10,000 in student loans for millions of debt-saddled former college students will cost roughly $24 billion a year assuming that three quarters of those eligible take up the offer, the White House said.,The move, announced by President Joe Biden on Wednesday, kept a pledge he made in the 2020 campaign for the White House and could boost support for his fellow Democrats in the November congressional elections.,Some economists said it may fuel inflation and Republicans mostly oppose student loan forgiveness, calling it unfair because it will disproportionately help people earning higher incomes.,On Wednesday, the White House said it had yet to determine the price tag for the package but on Thursday, White House spokesperson Karine Jean-Pierre told CNN:,""Assuming that 75% of folks take us on on the President's student loan cancellation plan, and you look at the average cash flow on that, it's going to be about $24 billion per year."",American university tuition fees are substantially higher than in most other rich countries, and U.S. consumers carry $1.75 trillion in student loan debt, most of it held by the federal government.,(Reporting by Costas Pitas in Los Angeles; Editing by Christian Schmollinger and Jacqueline Wong)",White House says student loan forgiveness plan will cost $24 billion a year,https://news.yahoo.com/white-house-says-student-loan-025806565.html
