author,date,description,source,text,title,url
"Tresa Baldas and Arpan Lobo, Detroit Free Press",2022-08-24T19:08:29.000Z,The verdict is redemption for the government in the second trial on the scheme to kidnap Gretchen Whitmer over her pandemic response.,Yahoo News,"GRAND RAPIDS – In a do-over for the government, a federal jury Tuesday convicted two men charged with , out of anger over her handling of the pandemic, ending a dramatic trial that highlighted the growth of violent extremism in America.,The jury deliberated for about eight hours over two days before delivering the guilty verdicts against Adam Fox and Barry Croft Jr., who were convicted on all counts and face up to life in prison for crimes they insisted were hatched by the FBI.,The verdicts drew praise from many in law enforcement and the legal community, especially Whitmer, whom prosecutors said was the target of extremists who wanted to settle their differences with violence.,The guilty verdicts came down on Whitmer's birthday.,“Today’s verdicts prove that violence and threats have no place in our politics and those who seek to divide us will be held accountable. They will not succeed,"" Whitmer said in a statement, adding: ,“But we must also take a hard look at the status of our politics. Plots against public officials and threats to the FBI are a disturbing extension of radicalized domestic terrorism that festers in our nation, threatening the very foundation of our republic,"" Whitmer said. “I cannot — I will not — let extremists get in the way of the work we do. They will never break my unwavering faith in the goodness and decency of our people."",Fox and Croft, who will be sentenced separately in December, were convicted of kidnapping conspiracy and conspiracy to possess weapons of mass destruction. Croft was convicted on an additional weapons charge.,The men were judged by a second, more diverse jury than in the first trial, which ended with no convictions for the government. Two men were acquitted in that trial and the jury deadlocked on charges against Fox and Croft Jr., triggering a mistrial that prompted the government to try again.,The historic case ends with four men going to prison and two others going free, two years after the FBI arrested all six on federal charges they plotted to kidnap the governor from her vacation home out of anger over her lockdown orders and mask mandates, and blow up a bridge near her home to slow down law enforcement. Five defendants were arrested in an FBI sting outside an Ypsilanti warehouse, where prosecutors said the men thought they were going to make a down payment on explosives, pick up free military gear, and then head to Buffalo Wild Wings for free beer and chicken. But it was all a ruse.,Croft was arrested at a gas station in New Jersey. Eight more individuals face , in the case.,""This verdict brings important accountability for perpetrators of violence against public officials,"" said former U.S. Attorney for the Eastern District of Michigan Barbara McQuade. ""Bringing these plotters to justice will cause others to think twice before engaging in similar conduct in the future."",McQuade applauded federal prosecutors in Grand Rapids for ""having the courage"" to retry the case, saying:,""It would have been easy for them to simply move on to the next case to avoid the possible embarrassment of a second mistrial or acquittal,"" McQuade said. ""But instead, they fulfilled their duty to protect the public."",Neither Fox nor Croft had any discernible reaction as U.S. District Judge Robert Jonker read the verdicts, both staring forward and occasionally leaning over to speak to their attorneys. Fox's mother, who attended every day of the retrial, shook her head as Jonker read the verdict.,The defense long argued that this was a case of entrapment, that the defendants were merely tough-talking potheads who were venting about their government, and that rogue FBI agents and informants set them up.,""We will most certainly appeal,"" Fox's lawyer, Christopher Gibbons, said after the verdict. ""Obviously, there was controversy in the trial."",The defense raised numerous issues during the trial, creating some tense moments in the courtroom. Defense attorneys accused the judge of , by repeatedly cutting them off during questioning, calling their arguments ""crap,"" and setting time limits only on the defense attorneys — telling them they could only take as much time to question witnesses as the prosecution.,The defense also took issue with the judge's handling of a, for alleged misconduct on the second day of trial. That juror allegedly told co-workers that his or her mind was made up about the case from the get-go, and was excited to be on the jury.,The judge dealt with the issue privately in his chambers, not allowing either the prosecution or the defense to be part of the proceeding.,""I think justice should happen in public,"" Croft's lawyer, Joshua Blanchard, said while leaving the courthouse Tuesday.,Blanchard had made a filing regarding the potentially problematic juror, and asked the judge to unseal it after the verdict — but Jonker said that will be explored in the future.,Throughout the trial, the prosecution argued the men did a lot more than talk — they took action to carry out their plan, including casing Whitmer's vacation home twice, building explosives, holding secret meetings, and practicing breaking-and-entering drills in shoot-houses they built that mimicked her cottage.,In the end, the jury sided with the government, delivering a major victory not only to the prosecutors, but to the FBI, whose reputation came under assault during both trials, with the defense repeatedly blasting agents and informants, calling them liars and manipulators with overreaching powers.,""The defendants in this case believed that their antigovernment views justified violence. Today's verdict is a clear example that they were wrong in that assessment,"" said Special Agent in Charge David Porter, who oversees the FBI office in Grand Rapids.,As lawyers left the room, U.S. Attorney for the Western District of Michigan Andrew Birge shook assistant prosecutor Nils Kessler's hand. Kessler, the lead prosecutor for both trials, urged the jury before it went into deliberations to remember one thing: that four men cased Whitmer's house in the middle of the night with guns, and planned to build a bomb.,Kessler drove this point home repeatedly during closing in what experts believed to be the strongest piece of evidence against the defendants: the surveillance trips, which jurors got to see for themselves. Prosecutors played video of the men driving by Whitmer's cottage on a rainy night, and audio recordings of Fox scoping out the cottage during a daytime surveillance excitedly stating: ""That's it. Dude, that's it. Turn around."",""The verdict confirms this plot was very serious, very dangerous and posed a threat not only to the governor personally, but also to innocent bystanders,"" Birge said.,The jury spent two weeks listening to testimony from FBI agents, informants and wiretapped conversations of the defendants themselves, in which they discussed kidnapping ""that tyrant bitch"" and trying her ""for treason."",Fox, the accused ringleader, was also heard telling an undercover FBI informant: ""'We’re gonna kidnap the bitch. We need a seven- to eight-member team. We’re gonna go up to her house and take a look at it ... and we’re going as low-profile tourists, pure Michigan bro.'"",Former U.S. Attorney Matthew Schneider, who has been closely following the case, said the prosecution learned a big lesson from the first trial and it's ""clear they changed their strategy"" to focus on what the defendants did before ever meeting FBI informants.,""However, the prosecution isn't out of the woods yet,"" said Schneider, who believes the judge's handling of the case, such as limiting defense lawyers' time limits to cross-examine witnesses, may give the defense grounds for appeal.,""The judge's ruling to severely limit the defense from cross-examining witnesses will be the No. 1 issue on appeal,"" Schneider said. ""I would not be surprised if this case gets reversed on appeal because of how the judge prevented the defendants from cross-examining the witnesses. Then we could see a third trial."",Prominent criminal defense attorney Mike Rataj, who represented one of the defendants in the failed , a decade ago, expressed similar concerns.,""The judge wanted this case over and done with really fast, and he got his wish,"" said Rataj, who believes the time limits imposed only on the defense raise due process issues.,Rataj also has issues with the judge's handling of the potentially problematic juror, arguing the defense and prosecution should have been allowed to participate in the inquiry of the juror.,""That's certainly going to be a centerpiece issue for appeal ... that’s certainly something they can hang their hat on,"" Rataj said of the defense, noting he was also perturbed at the jury selection process.,The jury was picked in one day. The judge did all the voir dire — or questioning — and gave both sides only 15 minutes to ask questions during the whole process.,""I said it before — it was rushed,"" Rataj said. ""And It seemed to me that the judge wanted this case over and done with in short order. I'm sorry. When people are facing life in prison, that's not the way a federal trial is supposed to be conducted.""","Jury convicts Adam Fox, Barry Croft Jr. in Whitmer kidnapping plot",https://news.yahoo.com/jury-convicts-adam-fox-barry-161018466.html
Chelsey Sanchez,2022-08-24T14:58:00.000Z,"Meghan teamed up with friend Serena Williams to release the first episode of her Spotify podcast, 'Archetypes.'",Yahoo News,"Meghan, Duchess of Sussex, has released a stunning new portrait for the , of her debut Spotify series, ,.,In the black-and-white photo, which serves as the podcast's cover art, Meghan poses against a gray backdrop while wearing a white ribbed tank top. Her long hair is down, with one half behind her shoulders and the other half cascading in front of her, and she is looking calmly into the camera. The cover art includes a dark green gradient border and text that reads, ""Archetypes with Meghan."",The 12-episode series sheds light on the tropes that women across generations have overcome and marks the first part of her and Prince Harry's , with the streaming giant.,The duchess explains the show's premise in the introduction. ""This is ,—my podcast about the labels and tropes that try to hold women back,"" she says. ""Over the course of the next dozen episodes, we're going to live inside and rip apart the boxes women have been placed into for generations—boxes like diva, crazy, the B-word, slut. Some of these words—these labels—are harsh; they're abrasive. And I want to get to the bottom of where they come from, why they've stuck around for so long, and—importantly—how we can move past them."",For the first episode, Meghan teams up with her friend Serena Williams to talk all things related to ambition, motherhood, and life in the public eye. Next week's episode will star Mariah Carey.",Meghan Markle Dropped a Breathtaking New Portrait and We've Never Seen the Duchess Like This,https://news.yahoo.com/meghan-markle-dropped-breathtaking-portrait-145800704.html
Milan Polk,2022-08-24T18:45:00.000Z,"Hulu's murder mystery comedy is already renewed. Starring Martin Short, Selena Gomez, and Steve Martin, Season 2 is currently airing.",Yahoo News,"Considering all the true crime documentaries and , out there, you’d think audiences would get bored of murder mysteries. But if anything, , proves we love a good whodunit. Hulu’s hit series is in ,, and much like Season 1, the show has the comedy, the intrigue, and the drama to make it one of the best shows to binge.,Starring Martin Short, Steve Martin, and Selena Gomez, the show is meta in its play on true crime podcasts and the obsessed fans of the medium who think they too can solve a murder. Except in the case of the ,’ tenants, they really ,close the case, mostly because the murder happened right in their building. At the end of Season 1 (spoiler), the trio discovered the murderer was none other than Charles’ (Martin) girlfriend Jan, an oboist who liked to kill off her boyfriends.,The second season kicked off right after the first, with the building manager, Bunny, murdered right after the group celebrated Jan’s arrest. Much like Season 1, there’s a host of unanswered questions (How did Bunny get into Mabel’s apartment? How does an expensive painting of Charles’ father connect to her death?) and a few celebrity guest stars (Cara Delevigne, Amy Schumer) to shake things up. , knew its strengths from the first season, and managed to stick to it and make yet another successful mystery.,It turns out (MAJOR spoiler alert) the real killer all along was Cinda's assistant, Poppy. Her real name was Becky, and she's the woman who disappeared in Cinda's hit podcast ""All Is Not Okay in Oklahoma."" Poppy wanted to run away from her previous life, while also giving her favorite podcast host a career boost. Bunny's murder, similarly, was a way for Poppy to boost her own career, get a famous painting, help out her cop boyfriend (Detective Kreps), and finally, to take down the beloved Only Murders trio. Thankfully for us, none of that came to fruition, and we have another season of crime-solving for our favorite Arconia residents.,So what about Season 3? Once Season 2 wraps, when can we expect more from the residents of the Arconia? Well, we’ve got your answer for you below.,Yes! According to ,, , is already renewed for Season 3. The show got yet another green light only a week into its second season, which means the show has once again been a rousing success for Hulu.,We don’t have an official date yet, since the show is still airing its second season. But, if the first two seasons are any indication, we can expect Season 3 to drop on Hulu sometime in the summer of 2023.,We can also expect to have 10 episodes of the new season, much like Season 1 and 2.,Steve Martin, Martin Short, and Selena Gomez can be expected to reprise their roles for Season 3, as well as most of the other characters in the Arconia. And after the Season 2 finale, , Paul Rudd will appear in Season 3! Ant-Man himself!,Rudd appears briefly in the Season 2 finale, where we see a one year time jump after Becky's arrest. Oliver is now directing a Broadway production starring Charles and another actor named Ben (played by Rudd). As Ben takes the stage, Charles gives him a harsh talking to, the curtain rises, and...Ben collapses, blood leaking from his mouth. So we're bound to see a lot of flashbacks with Rudd as the trio unravels everything leading up to the star's untimely end.,We’ll update this space as soon as we learn more. Check back here for the latest information on ,Season 3.",'Only Murders in the Building' Is Heading Back to The Arconia for Season 3,https://news.yahoo.com/only-murders-building-heading-back-193600683.html
Stixx M,2022-08-25T17:36:22.000Z,Selena Gomez is getting everything she can from the last few weeks of summer. The Rare Beauty...,Yahoo News," is getting everything she can from the last few weeks of summer. The , founder has been serving some serious , inspo — and we're here for it. Let's get into a discussion about Gomez's latest mellow yellow pastel nail update.,Gomez's resident , , took to , to introduce the sweet and sour tone of yellow , adorned on her fingertips. Bachik captioned the post, ""Calm (Down) Yellow for this ray of sunshine."" We're sure that the pop of color released the happiest endorphins for Gomez, as nail polish colors are known to induce happiness.,All summer long, Gomez's manicures have consistently been featured on our social media feeds, showing that you don't need designs, just a popping color set for seasonal ,, and you're all set. If you need a pick-me-up, let the pastel yellow Gomez is stunting be a deciding factor in your next polish choice.",Selena Gomez Has Her Hands Full of Sunshine With Pastel Yellow Manicure,https://news.yahoo.com/selena-gomez-her-hands-full-173622890.html
Christina Dugan Ramirez,2022-08-24T16:00:00.000Z,"""She had this massive monologue, pages and pages, and she was just so gracious with her time,"" Shum Jr., who will play surgical intern Benson ""Blue"" Kwan...",Yahoo News," Harry Shum Jr. and Ellen Pompeo, is officially scrubbing in!,In this week's issue of PEOPLE, the , alum, 40, opens up about starring in the upcoming 19th season of , as surgical intern Benson ""Blue"" Kwan, what fans can expect this time around, and the sweet welcome he received from star ,.,""For a show that's been on for this long, you would think, 'Okay, everyone is just doing the same thing.' But coming on to set, it was a completely different energy that I was expecting,"" says Shum. ""Even the actors that have been there since the beginning were not just welcoming, but also invigorated."",""The writers are really crafting some really interesting and fresh takes, while also infusing in the storylines that I think people have grown to love or find some comfort in as well,"" he adds.,In July, ABC , as Benson ""Blue"" Kwan, beside fellow additions Adelaide Kane, Alexis Floyd, Niko Terho and Midori Francis — all of whom will play first-year surgical residents at Grey Sloan Memorial.,A news release at the time described Shum's character as a ""sharp-witted, impatient, and brilliant first-year surgical resident at Grey Sloan."" It continued: ""He's generous by nature but competitive to a fault, naturally gifted, and used to winning at everything. A family crisis interfered with his career plans and now he's got a lot to prove."",Speaking to PEOPLE about taking on the role of Blue, Shum says, ""He's used to winning blue ribbons, and medals, and being number one until his mother died, and tragically. It just destroyed him and he hit a wall."",""And so he's a little later as an intern and coming into this, and has a hopeful life,"" he continues. ""All the interns have a hopeful life that they've crafted that we're going to explore. I'm really excited to dive deeper into it because it just gives so much wealth to figure out who these people are and why they even decide to become doctors."",Shum says he started watching , during the first season ""when it was magic,"" but his awe hasn't faded in the seasons since.,""There's ,, the things that they keep talking about, and it's a testament to the writer's room,"" he shares. ""I think the people involved in telling these stories, and also contributing in ways that go beyond just writing them out ... everyone is fully invested."", Harry Shum Jr.,Among those invested are , veterans Pompeo, , and ,""The first day we got to meet Chandra and James and it was iconic,"" says Shum. ""It was an iconic moment. Chandra, she just gave us this beautiful, just very, almost life advice of just be yourself on set, on the show, and try and contribute in so many ways that feel very true to yourself. I think that's why the show has gone on for so long. I think that advice has been given over time and has been utilized in so many beautiful ways."",Another memorable moment for Shum during his first day on set was meeting Pompeo, 52.,""The first day, she gave us a beautiful plant that all of the interns have, so we just try to make sure that it's healthy and staying alive throughout the whole season,"" Shum explains. ""Her first day, she had this massive monologue, pages and pages, and she was just so gracious with her time, and giving us advice, and just welcoming us to the OR."",""I look at her as someone who's so iconic, who's been doing this for so many years, but still again, having such a fresh energy, which is really inspiring,"" he adds.,During the season 18 finale in May, the Grey Sloan Memorial's residency program was shut down by the review board leaving quite a few residents orphaned, including Levi Schmitt (,), Taryn Helm (,) and Mabel Tsang (Sylvia Kwan).,The end of season 18 also saw Miranda Bailey (Wilson) quit as Chief of Surgery, leaving Meredith Grey (Pompeo) in charge.,Earlier this month, ABC announced that Pompeo will , and will appear in only eight episodes.,Season 19 of , premieres Oct. 6 at 9 p.m. ET on ABC.",Harry Shum Jr. on Joining Grey's Anatomy and His Warm Welcome from Ellen Pompeo: 'It Was Iconic',https://news.yahoo.com/harry-shum-jr-joining-greys-160000061.html
"Edward Segarra, USA TODAY",2022-08-25T02:42:09.000Z,"The Duke and Duchess of Sussex adopted Mia, a beagle who was ""tortured and abused"" at a breeding facility in Virginia, earlier this month.",Yahoo News,"A dog with a ruff past is getting a royal happily ever after.,Mia, a beagle who was ""tortured and abused"" at a breeding facility in Virginia, was adopted by , and , on Aug. 11, Shannon Keith, president of ,, confirmed to USA TODAY in an email.,Keith said on Wednesday that Meghan has been a longtime supporter of Beagle Freedom Project, an animal rescue nonprofit, and visited the organization’s Los Angeles headquarters with Harry to adopt Mia.,""Mia ran to them, and it was like they all just knew this was meant to be,"" Keith wrote.,Mia was bred for seven years, Keith shared, and her puppies were ""taken away from her and sold to laboratories."" Keith said the dog’s dark history was an important factor in the royal couple’s adoption of Mia.,""The Duke and Duchess made it a point to want to adopt dogs who are older and abused or neglected and often overlooked,"" Keith explained. ""When they came over, they were so gracious, kind and compassionate."",Mia is , from a facility owned by Envigo RMS in Cumberland, Virginia, in late July. The facility bred these dogs to be sold to laboratories for drug experiments.,just over half of the dogs had been removed, the Humane Society of the United States reported on its website.,The plan to remove the dogs kicked off when the federal government filed a civil lawsuit in May against Envigo RMS. ,, the U.S. Department of Justice alleged Animal Welfare Act violations at the facility.,Federal officials accused Envigo of a chain of violations, including dogs receiving insufficient food, inadequate medical care, housing in filthy conditions and some being euthanized without anesthesia. An inspection report from the U.S. Department of Agriculture found that, between January and July of last year, more than 300 puppy deaths were attributed to ""unknown causes"" — with the facility not taking any additional steps to investigate the deaths or prevent similar losses in the future.,The Sussexes weren’t the only famous faces moved to take action. Tammy Murphy, wife of New Jersey Governor ,, revealed on Twitter last week that her family ,""Proudly introducing the newest member of our family, Morty Murphy!"" Murphy wrote. ""He is settling in and already enjoying much deserved snuggles and treats."",On its website, The Humane Society wrote its shelter and rescue partners plan to place the dogs into foster and adoptive homes.,""While these dogs prepare for the next stage of their new lives, our work is far from over,"" the nonprofit posted on its Facebook page. ""Please, rush a donation to help transfer the remainder of these dogs and give more animals a better life.""","Duchess Meghan, Prince Harry adopt beagle rescued from animal testing facility",https://news.yahoo.com/duchess-meghan-prince-harry-adopt-024121933.html
