author,date,description,source,text,title,url
Rosa Sanchez,2022-08-25T15:50:00.000Z,"This week, the Ghost star has been enjoying a relaxing escape in Greece and sharing photos of both the fabulous nature views and her equally fabulous outfits...",Yahoo News,"It's Demi Moore's summer and we're just living in it.,This week, the , star has been enjoying a relaxing escape in Greece and sharing sunny photos of both the fabulous nature views and her equally fabulous outfits.,Last week, Moore , in a hot pink string bikini styled with a mustard-yellow button-up, which she wore open and rolled at the sleeves. She shared a photo of her posing on a yacht in the bright look and a pair of dark-tinted aviator sunglasses with red frames—the ocean and rocky mountains around her. ""Soaking up summer,"" she captioned the post.,""You’re such a hottie mama, my god,"" daughter Rumer Willis commented. ""And it looks good on you! 🔥😍,"" Emma Heming Willis, the wife of Moore’s ex-husband Bruce Willis, added.,Earlier this week, Moore shared another couple of yacht shots. One is of her sitting on the boat in a white ribbed bikini and her sunglasses—a mountain lined with green trees in the background. The other is of her tiny dog, Pilaf, resting on a gray couch on the yacht, which had a Greek flag waving in the back.,And just yesterday, Moore posted a photo of her looking like a happy local in a powder blue romper and white sneakers. She accessorized with a teal Christian Dior handbag, which she wore crossbody, her aviators, and a white Apple watch. But the star accessory, really, was her puppy, whom she carried in a DIY sling made from a blue scarf. ""Travel buddy,"" the actress wrote in the caption.,Moore's stunning bikini photos come after she , aimed at making women of all ages feel confident in their beach bodies.,""I started thinking about how the last few years it was about suits with barely any cloth, and how much I loved the kind of elegance and glamor of, in my perception, of some of these vintage suits and the imagery that came with them and how you can feel sexy and empowered and comfortable and not have to show a lot of skin,"" she told ,. ""So the idea is: How do we make a woman wear something that feels good and playful and sexy that is also creating security and confidence and still has style? That was our goal.""",Demi Moore Glows in Candid Bikini Photos from Her Holiday in Greece,https://news.yahoo.com/demi-moore-glows-candid-bikini-155000467.html
Sophie Lewis,2022-08-25T15:02:00.000Z,NASA scientists are gearing up for the world's first mission testing planetary defense — and they want you to watch.,Yahoo News,"NASA scientists are gearing up for the world's first mission , — and they want you to watch.,The space agency's Double Asteroid Redirection Test (,) will test technology to defend Earth against future asteroids and comets by deliberately crashing into an asteroid — which poses no threat to Earth — at some 15,000 mph. The target, a larger asteroid's moonlet named Dimorphos, measures about 525 feet wide.,The goal of the test is to prove that a spacecraft can autonomously navigate to a specific asteroid and purposely crash into it, disintegrating on impact and changing the object's speed and path. Scientists aim to measure that change using telescopes on Earth.,The mission doesn't quite mirror a sci-fi disaster movie like ""Armageddon,"" since it aims to deflect the asteroid rather than destroy it completely.,NASA plans to live stream the entire event on September 26, and it's inviting the public to tune in on its ,, ,, ,, or ,. A , will take place at 6 p.m. ET on ""Impact Day"" from the Johns Hopkins Applied Physics Laboratory in Laurel, Maryland, which builds and manages the DART spacecraft.,Researchers expect the kinetic impact to take place at 7:14 p.m. ET. The space agency is also hosting an , to mark the momentous occasion. ,Scientists launched the small, $330 million probe last fall, sending it to travel nearly seven million miles away from Earth. It's carrying another small spacecraft called LICIACube, which will be released from DART 10 days before impact in an attempt to photograph the collision and resulting debris.,Astronomers currently estimate there are about 25,000 near-Earth asteroids that are 500 feet or larger in size. DART will hopefully provide critical data to aid researchers in preparing for a future asteroid that could have a catastrophic impact on our planet — if they happen to discover one.","How to watch NASA spacecraft crash into asteroid at 15,000 mph",https://news.yahoo.com/watch-nasa-spacecraft-crash-asteroid-150200539.html
Emily Strohm,2022-08-25T16:00:00.000Z,"Christine, who has starred on TLC's reality series about her polygamous family since its inception in 2010, exclusively tells PEOPLE: ""I really believed in...",Yahoo News," never wanted to be someone's one and only. In fact, she wanted a husband that had been married exactly twice.,""I always thought that being the third wife would be the best,"" Christine, 50, says in the latest issue of PEOPLE. ""The first one had all the responsibility of the guy, which is way too much work. Then with the second one, it always seemed like there was a lot of hard times and change, so I'm like, 'No, don't sign me up for that.' Number three just coasts right in the middle. Easy."",Christine got her wish when she wed husband ,, now 53, in 1994 and moved into the tiny Lovell, Wyoming, home he shared with his two wives at the time , and ,. A fourth wife, ,, would eventually join as well.,""I really believed in plural marriage and wanted to live it,"" says Christine who stars on ,, TLC's hit reality series about her polygamous family., Christine Brown,But after more than two decades of marriage, she , from her Mormon fundamentalist faith and the only life she'd ever known in search of happiness.,""As soon as I had the car loaded up and drove down the street, I felt free,"" she tells PEOPLE.  ""It was exciting and new and so scary because I had no idea what to expect, but I remember feeling hope for the first time in a long time because I just got to take my life by my own and go."", Kody Brown (center), surrounded by Meri, Janelle, Christine, and Robyn Brown,Christine moved to Salt Lake City, Utah, in September 2021 and still lives there with daughter ,, 12. (The exes are also parents to son ,, 24, and daughters ,, 27; ,, 26; ,, 20, and ,, 19.),In November 2021, Christine officially , her split from Kody on Instagram., Christine Brown's kids,Since their split Christine has settled into her new life and launched her solo digital series , for TLC in February (season 2 premieres Sept. 11).,""I'm infinitely stronger than I ever was before. Happier. Oh my gosh, in my soul, I feel so light and easy and powerful,"" she tells PEOPLE. ""I absolutely love it every day."",Season 17 of , premieres Sept. 11 at 10 p.m. ET on TLC.",Sister Wives ' Christine Brown Always Wanted to Be Wife No. 3 in Polygamous Marriage: 'It Seemed Easiest',https://news.yahoo.com/sister-wives-christine-brown-always-160000016.html
Briana Ross-Williams,2022-08-25T22:33:01.000Z,A Jacksonville woman found guilty of vehicular homicide was sentenced to eight years in prison on Monday.,Yahoo News,"A Jacksonville woman found guilty of vehicular homicide was sentenced to eight years in prison on Monday.,The sentencing comes after Ana Jimenez was involved in a crash that left one person dead on April 11, 2019.,On that day, Jimenez told police that someone in a gray Chevrolet Suburban hit her white Honda Civic on the Buckman Bridge and she was hurt. That person was later identified as James Robinson.,Jimenez then followed Robinson and they got off San Jose Boulevard, where she tried blocking him in a nearby parking lot. She continued to follow Robinson back onto the Buckman Bridge where she chased him, cut him off, switched lanes and swerved into him against the barrier wall, witnesses said.,As the two drivers made their way to Highway 17, another witness said the two vehicles continued to collide with each other. Robinson eventually lost control as he tried changing lanes, veering off the road into oncoming traffic when he was killed.,Investigators said six total cars were involved, but the other drivers and passengers survived. The Florida Highway Patrol said the incident was caused by road rage.,Jimenez will serve seven years of probation following completion of her eight-year sentence.",Woman involved in deadly Jacksonville road rage incident sentenced to 8 years in prison,https://news.yahoo.com/woman-involved-deadly-jacksonville-road-223301174.html
Mitchell Willetts,2022-08-25T18:36:10.000Z,"One died at the scene, and the other was taken to a hospital, police said.",Yahoo News,"An argument between , ended with both men shooting each other, Texas police told news outlets.,It happened around 7 p.m. Wednesday, Aug. 24, San Antonio police said in a release.,Officers responded to an address on Twining Drive, a residential street on the city’s southwest side, and found two men with gunshot wounds.,The men, ages 37 and 41, had gotten into an “unknown dispute,” police said. At some point, one pulled out a gun and shot the other, who then fired back.,Police identified the men as ,, TV station WOAI reported.,Nobody saw the shooting, but neighbors heard gunfire, police told the outlet.,Officers performed live-saving efforts on one of the brothers, but he died at the scene, the SAPD said. The other was taken to a hospital in stable condition.,An investigation is underway, police said.","Arguing brothers pull out guns and shoot each other, Texas cops say. One was killed",https://news.yahoo.com/arguing-brothers-pull-guns-shoot-183610483.html
Nathan Frandino,2022-08-25T10:03:34.000Z,"California is about to launch an experiment to cover aqueducts with solar panels, a plan that if scaled up might save billions of gallons of otherwise...",Yahoo News,"By Nathan Frandino,HICKMAN, Calif. (Reuters) - California is about to launch an experiment to cover aqueducts with solar panels, a plan that if scaled up might save billions of gallons of otherwise evaporated water while powering millions of homes.,Project Nexus in the Turlock Irrigation District launches in mid-October amid Western North America's worst drought in 1,200 years and as human-influenced climate change exacerbates the dry spell.,The $20 million project, funded by the state, is due to break ground in two locations. One is a 500-foot (152-meter or about 0.3-mile) span along a curved portion of the canal in the town of Hickman, about 100 miles (160 km) inland from San Francisco. The other is a mile-long (1.6-km long) straightaway in nearby Ceres.,Based on a similar project in the west Indian state of Gujarat, the project is the first of its kind in the United States, said University of California Merced project scientist Brandi McKuin. The Turlock project was inspired by a research paper McKuin published in 2021.,Modern California was built thanks to 20th century infrastructure that delivers water from the wet north to the arid south, a network McKuin said now totals 4,000 miles (6,400 km) of canals.,Covering those canals with solar panels would reduce evaporation, avoid using other land for solar farms and reduce aquatic weed and algae growth, saving on maintenance costs, McKuin said.,""It's really exciting to test our hypothesis and the paper we published. We'll have an opportunity to really understand if those benefits pencil out in the real world,"" McKuin said.,It would also help California meet its renewable energy goal of achieving 50% clean energy generation by 2025 and 60% by 2030.,If all 4,000 miles of canals were covered with solar panels, it could produce 13 gigawatts of renewable capacity, roughly half of what California needs to meet its carbon-free energy goals, she said.,A gigawatt, or 1 billion watts, is enough to power 750,000 homes.,McKuin's research also calculated water savings of 63 billion gallons (238 million cubic meters), enough to supply 2 million people and irrigate 50,000 acres (20,000 hectares) of cropland.,Like other utilities throughout the state, Turlock Irrigation District Water & Power is required to expand its renewable energy capacity.,""If this is something that works on these first two miles of Project Nexus that we're doing, there's the potential that this could scale to multiple locations,"" said Josh Weimer, Turlock Water & Power's external affairs manager.,(Reporting by Nathan Frandino; Writing by Daniel Trotta; Editing by Donna Bryson and Mark Porter)","California to cover canal with solar panels in experiment to fight drought, climate change",https://news.yahoo.com/california-cover-canal-solar-panels-100334990.html
Kalyn Womack,2022-08-25T14:03:01.000Z,"I know that police arrest Black people for anything these days but this is just outrageous. A Childersburg, Ala. pastor was arrested while watering his...",Yahoo News,"I know that police arrest Black people for anything these days but this is just ,. A Childersburg, Ala. pastor was , while watering his neighbor’s flowers, according to ,. Per the video footage, several witnesses confirmed he was supposed to be there but the officers , to remove his handcuffs.,Pastor Michael Jennings of Vision of Abundant Life Ministries, returned home from service one Sunday in May and went to water his neighbor’s plants. That’s when someone , on him, claiming an unfamiliar SUV was parked outside the neighbor’s house and that an unknown man was lurking on the property. Per the ,, the officers approached Jennings asking him what he was doing at the house.,Read more,“Watering flowers,” Jennings responded. “I’m supposed to be here. I’m Pastor Jennings. I live across the street. I’m looking out for their house while they’re gone.”,Read how the situation escalated from ,:,According to the report, Jennings’ family also arrived to confirm his identity but the officers took him , and charged him with obstruction of government operation, which was dropped a month later. Now, the pastor is preparing a , against the police department.,Let’s just call a spade a spade. Jennings was racially profiled. For most states, you are not required to provide identification unless an officer has probable cause to believe you’re up to something criminal. The pastor was , watering flowers.,This situation is also about who called the police on him in the first place. If you see something, yes, say something. However, a Black man watering plants is far from a threat to society.,“It represents an abuse of police powers. It represents racial profiling and it represents law-enforcement officers intimidating a person who actually understands and knows their rights,” said Harry Daniels, Jennings’ attorney.",Police Arrest Alabama Pastor for ( No Joke) Watering Flowers,https://news.yahoo.com/police-arrest-alabama-pastor-no-140301444.html
KOCO - Oklahoma City Videos,2022-08-25T16:00:11.000Z,Family of Oklahoma man killed by James Coddington ‘can finally move on’,Yahoo News,Family of Oklahoma man killed by James Coddington ‘can finally move on’,Family of Oklahoma man killed by James Coddington ‘can finally move on’,https://news.yahoo.com/family-oklahoma-man-killed-james-160011738.html
David Shepardson,2022-08-25T17:54:18.000Z,WASHINGTON (Reuters) -Global shipping container suppliers China International Marine Containers and Maersk Container Industry in a joint statement on...,Yahoo News,"By David Shepardson,WASHINGTON (Reuters) -Global shipping container suppliers China International Marine Containers and Maersk Container Industry in a joint statement on Thursday said they have abandoned a merger plan, citing significant regulatory challenges.,China International Marine Containers (CIMC) in September had agreed to buy the Danish shipping company AP Moeller - Maersk's refrigerated containers maker for $987.3 million.,The U.S. Justice Department said the deal would have combined two of the world's four suppliers of refrigerated shipping containers and further concentrated the global cold supply chain.,The Justice Department said it ""would also have consolidated control of over 90% of insulated container box and refrigerated shipping container production worldwide in Chinese state-owned or state-controlled entities."",Assistant Attorney General Jonathan Kanter, who heads the Justice Department’s antitrust division, said the acquisition could have led to ""higher prices, lower quality, and less resiliency in global supply chains"" and ""would have cemented CIMC’s dominant position in an already consolidated industry and eliminated MCI as an innovative, independent competitor."",Germany's Federal Cartel Office said in December it also had opened an investigation into the effects the takeover of Maersk Container Industry (MCI) by CIMC could have on markets.,Maersk said it was ""unfortunate"" the deal would not move forward, adding it ""will now assess the best structural set-up to ensure the long-term development of the business."",Founded by Maersk in 1991, MCI employs 2,300 people in China and Denmark.,(Reporting by David ShepardsonEditing by Bill Berkrot)",Shipping container suppliers abandon $987 million deal after U.S. probe,https://news.yahoo.com/shipping-container-suppliers-abandon-merger-175418285.html
Charlie Mason,2022-08-25T16:11:18.000Z,"What’s in a name? Quite a lot, apparently. Five months after AMC announced that its Manhattan-set Walking Dead spinoff would be called Isle of the Dead, the ...",Yahoo News,"What’s in a name? Quite a lot, apparently. Five months after AMC announced that its Manhattan-set , spinoff would be called ,, the show has gotten a new title. And it is… ? Drumroll, please. ,, per ,.,As ,, the next offshoot of the long-running zombie drama will follow all the way to New York Lauren Cohan’s embattled Maggie and Jeffrey Dean Morgan’s Negan, the reformed villain who brutally murdered her husband before her eyes. Cut off from the mainland for ages, “the crumbling city,” the network teased, “is filled with the dead and denizens who have made New York City their own world full of anarchy, danger, beauty and terror.”, writer/executive producer Eli Journé has been tapped to act as showrunner on the new series, which is being overseen by the franchise’s chief content officer Scott M. Gimple with both of its leads pulling double duty as EPs. , is set to premiere in 2023, after the mother ship completes its 11-season run. (The first of the last eight episodes of , premieres on Sunday, Oct. 2, at 9/8c).,As ,-heads are no doubt well aware, AMC also has in the works an as-yet-untitled Daryl-,-centric spinoff starring Norman Reedus and a limited series that will wrap up the story of Andrew Lincoln’s Rick and Danai Gurira’s Michonne.,Launch Gallery: ,: Follow us on ,, ,, ",Isle Be! Walking Dead Spinoff Focused on Negan and Maggie Gets a New Title,https://news.yahoo.com/isle-walking-dead-spinoff-focused-161118936.html
The New Voice of Ukraine,2022-08-25T12:31:00.000Z,"Six months ago, Russia launched a full-scale invasion of Ukraine. Since then, Russia has occupied 13% more of the country, killed thousands of Ukrainians...",Yahoo News,"Russian soldiers have committed unspeakable war crimes and thousands of Ukrainian children have been forcibly relocated to Russia. One-third of Ukrainians have ,, sparking the largest refugee crisis since World War II.,Back in February, I was one of the few analysts who , Moscow to invade. Most remained skeptical in spite of Washington’s full-throated insistence and intelligence that an invasion was looming. The first six months of the war have continued to challenge assumptions. These are the six biggest surprises to me. ,Diplomacy failed, US threats flopped (US President Joe Biden even , outlining the US response to an invasion), and a beefed-up NATO presence in Eastern Europe before the invasion did nothing. The international system is now failing Ukraine in seeking justice for war crimes and restitution for billions in damage. Even after six months of war, the West has nothing real to offer Ukraine in terms of permanent security guarantees. ,The Russian army has a long history of brutal violence, but it seemed unthinkable that soldiers would engage in the mass rape, torture and killing of civilians whom the Russian regime officially considers their Slavic brothers. And yet this is exactly what they did in towns and villages on the outskirts of Kyiv. Russia’s deliberate bombing of a theater in Mariupol that was known to be sheltering women and children defies belief.,As Andrii Osadchuk, a Ukrainian MP with the Holos party recently reminded me, it previously seemed unthinkable that the Russian army would eliminate Russian-speaking village after village in southeastern Ukraine, thereby destroying its own political stronghold in the country. Russia’s actions in southeast Ukraine alone expose the myth of Slavic brotherhood., ,President Biden didn’t ask the American public to do anything beyond pay higher prices at the pump. He has done a ton for Ukraine, and he and his team deserve huge credit for many things, but messaging to the public isn’t one of them., for elites in the , explaining what the US will and will not do in Ukraine isn’t enough. It’s not quite as bad as when President George W. Bush told the American public to go shopping after 9/11, but Biden’s inattention to messaging to the American public doesn’t get high marks.,Russia’s war in Ukraine will be long and drawn out. The outcome of the war depends on how long the West will sustain the effort with weapons and financial support. It all hinges on public opinion in the end. The lack of public messaging during the first six months of the war is a shame because Biden has an extraordinary gift for connecting with average people and fervently believes in the cause of freedom.,Less than a year ago, Ukrainian President Volodymyr Zelenskyy came to Washington for a visit. I , why he bothered with no real achievements to show. He was trying to boost investment in Ukraine without engaging in the real work of reform. In his first two years in office (2019-2021), he showed little interest in the often boring and complicated details of policy, opting instead for quick fixes. Rather than overhaul the courts, he flirted with the idea of investment nannies who would help Western businesses if they encountered any problems with Ukraine’s notorious law enforcement and legal systems.,He began the war by rejecting overtures to leave Kyiv and govern from western Ukraine or Poland. He has since inspired the world with his personal heroism and courage while brow beating Western governments to do more and explaining to the world the price of freedom.,As a war leader, Zelenskyy has a reputation for respecting his generals and leaving the big strategic decisions up to them. He has also become a staunch defender of Ukraine. During his 2019 presidential election campaign, many people questioned Zelenskyy’s patriotism and commitment to Ukraine. Up until February 24, he showed willingness to compromise and negotiate to end the war. No longer.,The Kremlin never understood how much Ukraine fundamentally changed since the country’s 2014 Euromaidan Revolution. Moscow failed to grasp that the reforms put in place over the past eight years were genuine, however haltingly they were implemented. This was especially true in terms of military reforms.,As Daniel Szeligowski at the Polish Institute of International Affairs ,, Russians completely misinterpreted polling data from Ukraine showing that Ukrainians disliked their political authorities but trusted the country’s military. This led to the disastrous conclusion in Moscow that if Russia could wipe out the Ukrainian military, Ukrainians would be glad to accept new leaders. How wrong they were.,Ukraine is not a failed state. Six months after the start of the Russian invasion, Ukraine’s banking system continues to work. Ukraine pays public sector workers on time. Hospitals and schools still function. The state railway moved millions of Ukrainians out of harm’s way. Central election data was closed and moved abroad to protect it from Russian hackers. Government ministries partnered with volunteers to deliver humanitarian goods and medicine across the country. Ukraine’s weak state institutions have proved surprisingly durable during war., ,What surprised you the most? We would love to know.,Read the original article on ",Russia’s war in Ukraine: Six surprises six months in,https://news.yahoo.com/russia-war-ukraine-six-surprises-123100584.html
BuzzFeed,2022-08-24T21:51:03.000Z,"Samuel L. Jackson likes to collect action figures of his characters, and I just love that.View Entire Post ›",Yahoo News,,"Lots Of Celebrities Have Jaw-Dropping ""Personal Life"" Sections On Wikipedia — But I Wanna Know The Best",https://news.yahoo.com/whats-most-interesting-celebrity-wikipedia-215103819.html
